article_id,title,published_date,section,body_text,url
1264215,“국조만 하고 물러나라” 장동혁 향해 ‘수정 사퇴론’…당권파는 반발,2026-06-18,정치,"국민의힘에서 18일 장동혁 대표를 향해 ‘선거관리위원회 국정조사 뒤 사퇴론’이 제기됐다. ‘선관위 사태 해결’을 대표직 유지 명분으로 내세우며 꿈쩍 않는 장 대표에게 그것까지만 하고 물러나라는 ‘수정 사퇴론’이 나온 것이다. 우재준 청년최고위원은 이날 국회 최고위원회의에서 “지도부가 선관위 사태가 좀 마무리되는, 적어도 가을 전에는 임기를 종료하는 걸로 했으면 좋겠다”며 “그렇다면 적어도 지도부가 선관위 사태를 정치적인 유불리에 이용한다는 불신도 해소할 수 있을 것이다”고 말했다. 그는 지난 11일에도 공개발언을 통해 지도부 총사퇴를 제안했다. 장 대표는 우 최고위원 제안에 답하지 않았다고 한다. 당 법률지원단장을 맡은 곽규택 의원도 문화방송(MBC) 라디오에 출연해 “(전날 의원총회에서) 지금 당장 사퇴보다 이번에 부실선거 사태로 인한 국정조사 등 국면이 마무리될 때쯤 당 지도부가 스스로 거취를 결정하라는 얘기가 많았다. 저도 동의한다”고 말했다. 수도권 한 의원은 한겨레에 “선관위 사태 해결 뒤 사퇴라는 퇴로를 마련해줄 필요가 있다”고 했다. 유승민 전 의원은 채널에이(A) 유튜브 채널에 출연해 “재선거 이슈 가지고 장 대표가 버텨봐야 얼마나 버티겠나”라며 “교체되는 것은 시간문제”라고 했다. 당권파는 반발했다. 조광한 최고위원은 “자꾸 마이크만 잡으면 외계어를 하시는 분”이라고 우 최고위원을 저격했고, 김민수 최고위원도 비공개 회의 시간에 “(선거 결과에) 책임져야 한다는 사람들이 사퇴하라”고 공세를 폈다. 장 대표는 최고위원회에서 선관위 투표용지 부족 사태에 대해 “이제 특검이다. 국민의힘이 추천하는 특검에 진상 규명과 책임자 처벌을 맡겨야 한다”며 정청래 더불어민주당 대표에게 회동을 제안했다. 거듭 선관위 사태 해결이 자신의 임무임을 강조한 것이다. 한편, 장 대표는 이날 서울 시내 한 병원에 입원했다. 당 관계자는 “장 대표가 서울 송파구 올림픽공원 개표소 봉쇄 시위 현장 방문 등 과로로 인해 병원 응급실을 찾았다가 의료진 권유로 입원했다”고 말했다.",https://www.hani.co.kr/arti/politics/politics_general/1264215.html
1264208,‘453조원 재건기금’ 논의한 이재명-트럼프…정부 “미-이란 협상 주시”,2026-06-18,정치,"미국과 이란이 서명한 종전 양해각서(MOU)에 최소 3000억달러(약 454조원)의 이란 재건기금이 명시됐다. 한국 기업들의 참여도 거론되는 상황에서 한국이 어떤 역할을 하게 될지도 중요한 변수가 됐다. 이재명 대통령과 도널드 트럼프 미국 대통령은 이에 대해서도 이야기를 나눴다고 청와대는 밝혔다. 유럽을 방문한 이 대통령은 16일(현지시각) 프랑스 에비앙레뱅에서 열린 주요 7개국(G7) 정상회의 공식 만찬에서 트럼프 대통령과 나란히 앉아 90분 동안 대화하며 ‘이란 재건 기금’에 대해 논의했다. 청와대 핵심 관계자는 “이 대통령은 향후 호르무즈해협 내 자유롭고 안전한 통항 보장을 위해 미국을 포함한 모든 국제사회 노력에 실질적으로 기여하겠다는 의지와 역량이 있다고 말했다”고 전했다. 이런 원칙적인 언급에도 불구하고 이란 재건 기금의 성격과 내용은 앞으로 60일 동안 미국과 이란의 협의 과정에서 구체화될 것으로 예상되고, 정부도 이를 주시하며 판단할 것으로 보인다. 외교부 당국자는 18일 재건기금은 “앞으로 진행될 이란 핵 문제에 관한 최종 합의와 연계된 사항으로 안다”면서 “관련 논의를 주시하면서 관련 국가 동향을 파악해 나갈 것”이라고 말했다. 한국을 비롯한 일본, 싱가포르, 말레이시아 등의 기업들이 출자를 약속했다는 보도가 나왔지만, 아직 한국 정부나 기업에 요청이 온 것은 없고 함께 거론된 다른 나라들도 요청을 받은 바가 없는 것으로 전해졌다. 미-이란 간의 핵 협의, 호르무즈해협의 미래, 제재 해제 등이 구체적으로 논의돼야 재건기금의 윤곽도 정해질 것으로 보인다. 14개항의 미-이란 종전 양해각서 가운데 제6항은 ‘미국이 역내 파트너들과 최소 3000억달러 규모의 이란 재건·경제 발전 계획을 수립”한다는 내용이다. 미국 정부 자금이 투입되는 전통적인 재건·배상 프로그램과 달리, 민간 기업들이 자금을 내 이란의 에너지·물류·제조·운송 인프라 등에 투자하는 구조로 논의되고 있다고 알려졌다. 트럼프 대통령은 17일(현지시각) 에비앙레뱅에서 주요 7개국 정상회의 일정을 마친 뒤 기자들과 만나 “우리는 돈을 내지 않는다. 미국은 아무것도 줄 필요가 없다”며 “다만 어떤 사람들이 투자하고 싶어 할 수는 있다”고 말했다. 전문가들도 미국과 이란 사이에 구체적인 내용이 확정되는 것을 면밀히 파악한 뒤 참여 여부와 방식을 결정해야 한다고 조언한다. 윤강현 전 주이란대사는 “미국이 한국 기업들의 참여 등을 염두에 두고 구상하는 단계이고 아직 한국 쪽과 구체적 논의를 시작한 단계는 아닌 것으로 보인다”면서 기금이 구체적으로 어떻게 운영될지를 잘 파악해 참여 여부를 결정해야 한다고 강조했다. 윤 대사는 “2016년에 한국 기업들이 이란에 들어가 사업을 하도록 한국 정부가 기금을 제공하고 나중에 이란이 갚는 방식으로 한국과 이란 정부가 합의했는데, 트럼프 1기 행정부가 이란 제재를 강화하면서 무산됐다”면서 “그런 방식으로 우리 기업들이 직접 사업을 하는 방식이라면 참여할 여지가 있지만 미국이 한국의 돈만 가져다 운영한다면 동의하기 어렵다”고 말했다. 한국 기업들이 참여한다면 자금 회수 방식을 비롯한 기술적인 문제들, 미국의 대이란 제재 완화가 어떤 방식으로 되는지를 모두 고려해야 한다고도 조언했다. 유달승 한국외대 이란페르시아어과 교수도 “이번 재건 기금은 미국 기업들이 이란 재건 시장을 차지하려는 의도가 있지만, 우리도 이란에 다시 들어가기 위해 참여를 검토할 필요가 있다”고 말했다. 그러면서도 “우리 기업들이 돈만 내는 상황이 되지 않도록 우리 정부와 기업이 미리 태스크포스를 만들어서 정부가 여러 외교적 역할을 해야 하고, 대통령의 이란 방문이나 이란 대통령 방한 초청 등을 통해 정상 간 논의를 하는 것도 좋은 방안이 될 수 있다”고 제안했다.",https://www.hani.co.kr/arti/politics/politics_general/1264208.html
1264204,"“똑같은 정치 안 하겠다”더니, 승부수가 ‘피습 자작극’이었나",2026-06-18,정치,"6·3 지방선거에 출마했던 정이한 개혁신당 부산시장 후보의 ‘피습 자작극’ 의혹이 일파만파 커지는 가운데 정 전 후보의 짧았던 정치 인생에 관심이 쏠린다. 부산시장에 출마하며 “지루하고 똑같던 정치에서 벗어나겠다”던 정 전 후보는 경찰 수사 결과에 따라 한국 정치사에서 유례를 찾아보기 힘든 초유의 사건을 일으킨 주인공이 될 수도 있다. 1988년 부산에서 태어난 정 전 후보가 첫 정치 행보를 시작한 곳은 국민의힘이다. 정 전 후보는 한 시민단체 청년단장을 거쳐 2022년 9월부터 2024년 7월까지 부산이 지역구인 백종헌·박수영 국민의힘 의원실에서 일했다. 이후 자리를 옮겨 지난해 6월까지 한덕수 전 국무총리 시절 국무총리비서실 사무관으로 일한 정 전 후보는 국민의힘이 아닌 개혁신당 대변인 자리를 택했다. 개혁신당을 택한 이유에 대해 정 전 후보는 지난해 12월 한 언론사 유튜브에 출연해 “이준석 대표가 (국민의힘) 당대표에서 축출되고 본인만의 어려운 길을 가려고 하는 모습들이 저뿐만 아니라 젊은 세대에게 던지는 메시지가 분명하다고 생각했다”며 “그런 모습을 보면서 정말 살아가는 데 있어 정치의 롤모델로 삼았던 게 이 대표”라고 밝힌 바 있다. 해당 인터뷰에서 정 전 후보는 당시 내란 중요임무 종사 혐의로 재판을 받고 있던 한 전 총리를 두고 “인격적으로 정말 존경하는 분”이라며 “지금 어려운 시기를 지나고 계시지만 이게 다 끝나서 본인이 원래부터 추구하고자 하셨던 그런 편안한 삶을 다시금 얻으셨으면 하는 그런 바람도 있다”고 말하기도 했다. ‘정치 신인’ 정 전 후보가 전국적으로 알려지게 된 건 선거 유세 중 한 남성이 던진 음료를 피하려다 다쳤다는 언론 보도가 나오면서다. 정 전 후보는 4월27일 오전 8시5분께 부산 금정구 세정타워 근처 도로에서 신호 대기 중이던 승용차 운전자들에게 명함을 나눠주며 선거 유세를 하고 있었다. 당시 정 후보 쪽은 한 운전자가 차 안에 있던 음료수를 뿌리자 정 후보가 이를 피하려다 넘어져 의식을 잃은 채 병원으로 옮겨졌다고 주장했다. 경찰은 당일 오후 2시20분께 해당 운전자인 30대 남성을 긴급체포했다. 이후 정 후보는 이 남성을 면회하고 선처 탄원서를 제출했으며, 이틀 뒤인 29일 목 보호대를 착용하고 선거운동에 복귀했다. 다음 행보는 단식이었다. 부산시선거관리위원회가 주최하는 방송 토론회에는 나갈 수 있지만 민간방송들이 주최하는 방송 토론회에는 자신이 제외된다는 점에 반발한 것이다. 5월8일 단식농성에 나선 정 전 후보는 일주일 만에 건강 악화로 단식을 중단했다. 방송 토론회에 나가선 ‘거짓말 탐지기’를 꺼내 들어 논란을 일으켰다. 5월26일 부산시선관위가 주최한 방송 토론회에 나간 정 전 후보는 생방송 중 갑자기 거짓말 탐지기를 꺼냈다. 정 전 후보는 “사비를 들여 직접 미국에서 공수해 왔다”고 밝히며 전재수 더불어민주당 부산시장 후보를 향해 “(통일교 관련) 본인에 대한 비리가 수사가 종결되고 끝났지만, 거짓말 탐지기를 통해 본인에 대한 의혹을 떨칠 수 있는 의향이 있는지 여쭙고 싶다”고 물었다. 다만 전 후보가 “지켜야 할 선은 지켜달라”고 말하며 거부해 실제 사용되진 않았다. 이를 두고 부산민주언론시민연합은 정 전 후보가 “‘자신의 ‘정치쇼’를 위해 민주주의 핵심 공론장을 희화화하고 훼손했다”며 비판했다. 3위로 낙선한 정 전 후보는 정계 은퇴를 선언했다. 잊히는 듯 했던 정 전 후보는 ‘피습 자작극 의혹’으로 논란의 중심에 섰다. 주간조선은 17일 “부산금정경찰서가 정이한 후보를 위계에 의한 공무집행방해와 허위사실 공표, 공직선거법 위반 등의 혐의를 적용해 수사 중”이라고 보도했다. 경찰은 정 전 후보 피습 사건이 자작극일 가능성이 있다고 보는 것이다. 정 전 후보가 이미 당 온라인시스템을 이용해 탈당한 사실도 알려졌다. 개혁신당은 △당 자체 진상조사단 가동 △무관용 법적 대응 △영구 복당 금지 처분 등을 예고했다. 이준석 개혁신당 대표는 “무한한 책임감을 느낀다”고 사과하며 “당 자체 진상조사단을 가동해 드러나는 사실관계에 따라 정 전 후보에게 최고 강도의 민·형사상 책임을 엄정히 묻겠다”고 했다. 현재 정 전 후보의 페이스북에서는 어떠한 게시글도 찾아볼 수 없다. 18일 오후 기준 아직 열려 있는 인스타그램에는 지난 3일 쓴 글이 마지막으로 남아 있다. “여러분들의 보내주신 성원에 깊이 감사드립니다. 모두 수고하셨습니다”라며 ‘부산광역시장 후보 정이한, 젊은부산 청년시장’이라는 문구를 사진에 넣은 정 전 후보는 웃으며 카메라를 향해 손을 흔들고 있었다.",https://www.hani.co.kr/arti/politics/politics_general/1264204.html
1264192,‘선관위 국조’ 국회 본회의 통과…오늘부터 45일간 본격 조사,2026-06-18,정치,"6·3 지방선거 투표용지 부족사태 진상규명과 선거관리 개혁을 위한 국회 국정조사가 18일부터 8월1일까지 45일 동안 진행된다. 국회는 18일 본회의를 열어 재석 의원 251명 가운데 찬성 250명, 반대 1명(최혁진 무소속 의원)으로 ‘제9회 전국동시지방선거 투표용지 부족사태 등 국민 참정권 침해 진상규명 및 선거관리 개혁을 위한 국정조사계획서’를 의결했다. 대상 기관은 중앙선거관리위원회와 각급 선관위다. 조사 범위는 △투표용지 부족 사태 발생 경위 △투표용지 인쇄 수량 산정 기준 수립 과정의 부실 여부 △사태 당일 선관위의 현장 관리·사후 대응 적절성 여부 △투·개표소 집회 시위 및 경찰 조치 사항, 선거관리 전반 점검 등이다. 조사 기간은 본회의 의결을 통해 연장할 수 있다. 특위는 국민의힘 소속인 윤상현 위원장을 포함해 더불어민주당 9명, 국민의힘 7명, 비교섭단체 2명(이준석 개혁신당 의원, 정춘생 조국혁신당 의원) 등 총 18명으로 꾸려졌다. 여야는 본회의에서 6·25 전쟁 공로자 유가족 범위를 확대하는 6·25전쟁 무공훈장 수여 등에 관한 법률 일부개정법률안과 브레이크가 없는 픽시 자전거 규제 근거를 담은 자전거법 등 비쟁점 법안 30개도 합의 처리했다.",https://www.hani.co.kr/arti/politics/politics_general/1264192.html
1264187,“옆 투표소서 400매 빌림” “선관위 연락 불가”…혼란상 담긴 투표록 공개,2026-06-19,정치,"( ☞한겨레 뉴스레터 H:730 구독하기. 검색창에 ‘한겨레 h730’을 쳐보세요.) ‘15:51 투표용지가 소진된 후 지침을 달라 요청했으나 답변받지 못했고 전화 다시 준다고 했으나 연락이 없음’, ‘16:35 투표용지 전량 소진. 선거인, 참관인께 안내 후 투표 중단함’(송파구 잠실2동 제6투표소 투표록) 6·3 지방선거 투표용지 부족 사태가 발생한 투표소의 당시 상황이 기록된 ‘투표록’이 공개됐다. 투표소 현장에서 시간대별로 벌어진 혼란이 상세히 기록돼있어 투표용지 부족 사태 진상 규명에 핵심 근거가 될 전망이다. ‘선관위 국정조사 특별위원회’ 소속 주진우 국민의힘 의원이 중앙선거관리위원회에서 제출받아 18일 공개한 서울 송파·강남·광진·동작·서초구 투표소 439곳의 투표록에는 투표용지 부족 상황 발생 뒤 벌어진 투표 시간 연장과 대기표 배부, 투표용지 추가 수송 등의 일련의 과정에서 투표관리인들과 유권자들이 겪었던 혼란이 고스란히 담겼다. 혼란이 극심했던 송파의 경우 올림픽공원 봉쇄 시위로 확보 불가한 투표록을 제외하고 52곳의 투표록이 공개됐다. 투표용지 부족 상황이 가장 먼저 알려진 송파구 잠실2동 제6투표소의 투표록의 ‘특기사항’을 보면 오후 2시53분에 ‘용지 238매 남았음을 동에 고지하고 추가 교부 요청’이라는 문구가 처음으로 등장한다. 그 뒤 3시10분부터 40분까지 세 차례 선관위에 연락했지만 후속 조처는 이뤄지지 않았고 4시35분에 투표용지가 전량 소진됐다. 그로부터 1시간20여분 뒤인 5시59분에 ‘일련번호 없는 투표용지 50매 배달함’이라고 적혔다. 투표용지 도착 이후 추가 교부 투표지에서 수기 기재 오류가 발견되고 도장이 누락되는 등의 일이 벌어지면서 정자체였던 글씨는 형태를 알아보기 힘든 날림 글씨로 바뀌었다. 잠실7동 제2투표소도 상황은 비슷했다. 오후 3시30분 투표용지가 220매밖에 남지 않은 사실을 인지하고 3시45분 200매를 추가로 요청하고, 4시46분 투표를 일시 중단한 후 대기 중인 유권자들에게 대기표를 발급하고 안내했다고 적었다. 5시39분부터 추가 투표용지를 수령해 일련번호를 수기로 입력했다. 잠실 우성아파트 등에 여러 차례 투표 안내 방송을 밤 10시까지 어떤 내용으로 몇 차례 했는지 등도 적혔다. 대기표를 받고도 저녁 8시35분까지 오지 않은 인원은 17명으로 기록돼있는데, 숫자가 수정된 기록도 보인다. 이밖의 투표소에서도 “투표용지 부족해 대기해야 한다고 안내하니 시간 없다며 포기하고 감’ (구의3동 제3투표소), ‘가락2동 2투표소에서 400매 빌림’(가락2동 제3투표소), ‘100매라고 전달받았으나 시간이 오래 지체돼 총매수는 확인하지 못한 채 투표재개’(잠실2동 제2투표소) 등 일련번호 없는 용지 교부, 투표소 간 용지 대여, 투표 포기와 민원 제기 등의 정황이 곳곳에 담겨있다. 한편, 중앙선관위가 4년 전 지방선거와 지난해 대통령 선거에서도 일부 투표소에서 추가 투표용지를 사용했던 것으로 드러났다. 임미애 더불어 민주당 의원이 중앙선관위로부터 받은 자료를 보면, 4년 전 제8회 지방선거 때도 투표소 총 2곳에 100∼200장의 추가 투표용지가 투입됐다. 2024년 22대 총선에서도 투표소 1곳에 추가 투표용지가 보내졌고, 지난해 21대 대선에선 투표소 42곳에 적게는 50장에서 많게는 500장의 투표용지가 추가로 보내졌다. 다만 앞선 세 번의 선거에서는 선거인이 투표용지를 기다리며 대기하거나 투표가 중단된 사례는 없었던 것으로 파악됐다.",https://www.hani.co.kr/arti/politics/politics_general/1264187.html
1264173,"[뉴스 다이브] 이 대통령, 정청래 대표 만났다",2026-06-18,정치,"출연: 박진영 정치비평가, 정구승 변호사, 임세은 민주당 선임부대변인, 이광수 명지대 겸임교수·‘광수네 복덕방’ 대표. 진행: 고현준. 이 대통령 귀국...정청래 대표와 악수, 봉합 수순?/정청래 ’90도 인사’ ...이 대통령 “수고했습니다”/“정청래 쪽, ‘불출마하면 대통령 당무개입 논란’” 보도 나와/트럼프 “이 대통령 강한 지도자...한반도 평화 역할하겠다”/“찌질이”·‘사퇴 촉구 기자회견’까지...장동혁 버티기 지속?/‘기획 부동산 투자 의혹’ 집중 보도...보수언론 장동혁 때리기?/한동훈, 친윤 주축 ‘미래혁신포럼’ 가입...복당 사전 작업?/오세훈, 징역 1년6개월 구형...“검사님들 떳떳하십니까”/서울시, ‘GTX 철근 누락’ 보도 MBC에 3억 손해배상 소송/경찰, 개혁신당 부산시장 후보 ‘피습 자작극 의혹’ 수사/코스피, 장중 최고치 경신 8,900선...9천피 가나?/정부, 부동산 세제 개편안 7월 말 발표...시장 영향은? 오늘 (6월 18일) 뉴스 다이브 많은 시청바랍니다.",https://www.hani.co.kr/arti/politics/politics_general/1264173.html
1264166,"국회, ‘투표용지 부족 사태’ 국정조사 의결…8월1일까지 45일간",2026-06-18,정치,"지난 3일 치러진 지방선거 투표용지 부족 사태 진상규명과 선거관리 개혁을 위한 국정조사 계획서가 18일 국회 본회의를 통과했다. 국회는 이날 본회의를 열어 재석 의원 251명 중 찬성 250명, 반대 1명으로 ‘제9회 전국동시지방선거 투표용지 부족사태 등 국민 참정권 침해 진상규명 및 선거관리 개혁을 위한 국정조사계획서’를 의결했다. 최혁진 무소속 의원이 반대 의사를 밝혔다. 국정조사는 이날부터 오는 8월1일까지 45일간 진행된다. 대상 기관은 중앙선거관리위원회 및 각급 선거관리위원회다. 활동을 연장할 필요가 있는 경우, 본회의 의결로 연장도 가능하다. 국정조사 특별위원회는 더불어민주당 9명, 국민의힘 7명, 비교섭단체 2명(이준석 개혁신당 의원, 정춘생 조국혁신당 의원) 등 총 18명으로 꾸려졌다. 특위 위원장은 윤상현 국민의힘 의원이 맡는다.",https://www.hani.co.kr/arti/politics/politics_general/1264166.html
1264164,‘사퇴 압박’ 장동혁 입원…“단식·선거 이어 선관위 사태로 과로”,2026-06-18,정치,"장동혁 국민의힘 대표가 18일 과로로 인해 병원 응급실을 찾았다가 의료진의 권유로 입원했다. 당 지도부 관계자는 “장 대표가 단식 이후 지방선거 지역 유세, 중앙선거관리위원회 사태 현장 대응 등으로 피로가 누적돼 입원했다”고 말했다. 장 대표는 지난 1월 ‘통일교 게이트·더불어민주당 공천 헌금 의혹'에 대한 ‘쌍특검’을 요구하며 8일 동안 단식했다. 6·3 지방선거 본투표 당일에는 투표 용지 부족 사태가 벌어지자 밤새 중앙선관위와 서울선관위 등을 찾았고, 이후 서울 송파구 올림픽공원 개표소 봉쇄 시위 현장을 오갔다.",https://www.hani.co.kr/arti/politics/politics_general/1264164.html
1264155,"윤석열 때 쓴 “북 정권, 우리의 적”…국방부 “유지” 통일부 “바꿔야”",2026-06-18,정치,"올해 말 발간 예정인 ‘2026 국방백서’에서 기존의 ‘북한 정권과 북한군은 우리의 적’이란 표현이 바뀔 수 있다는 언론 보도에 대해 국방부가 “북한 정권과 북한군이 우리의 적이라는 입장에 변함이 없다”는 입장을 18일 냈다. 이경호 부대변인은 이날 국방부 정례브리핑에서 “올해 국방백서는 현재 초안을 마련 중이고, 작성 방향을 검토하고 있다”며 이렇게 밝혔다. ‘북한 정권과 북한군은 우리의 적’이란 표현은 윤석열 정부 때 펴낸 ‘2022 국방백서 2022’에 명시됐는데, 이를 유지하겠다는 취지다. 그러나 통일부는 이에 대해 이견을 드러내며, 국방백서에 대한 부처 의견 수렴 과정에서 해당 표현의 변경이 필요하다는 입장을 밝혔다. 통일부 당국자는 이날 기자들과 만나 “한반도 평화공존은 이재명 정부의 확고한 정책 목표로, 북한을 주적으로 규정하는 상태에서 주적인 북한과 평화공존을 추구할 순 없다”며 “주적 개념은 과거 노무현·문재인 정부의 연장선상에서 논의돼야 하고, 국방백서도 이런 맥락에서 검토될 필요가 있다”고 말했다. 국방백서는 정부 국방정책 기조를 담고 있기 때문에, 이재명 정부 들어 처음 발간되는 ‘2026 국방백서’에선 북한을 어떻게 규정할지 관심이 모였다. 이재명 정부가 ‘한반도 평화공존’을 새 대북정책으로 제시하면서, 북에 대한 적대적 표현이 완화될 수 있다는 전망도 나왔다. 그러나 남북 관계 경색이 계속되면서 국방부도 북한 정권과 북한군을 적으로 규정한 지난 정부 기조를 이어가고 있는 셈이다. 2023년 발간된 ‘2022 국방백서’는 6년여 만에 ‘대한민국을 명백한 적으로 규정하고 핵을 비롯한 군사 위협을 지속 가해오는 북한 정권과 북한군은 우리의 적’이라고 명시했다. 윤석열 정부는 ‘2024 국방백서’도 펴내려 했지만, 12·3비상계엄 여파로 발간하지 못했다. 북한을 적 또는 주적으로 규정해야 하는지를 둘러싼 논쟁은 오랜 시간 이어졌다. ‘주적’ 표현은 1994년 북한의 ‘서울 불바다’ 발언을 계기로 김영삼 정부 때인 1995년 국방백서에 처음 사용됐다. 이후 2000년까지 발간된 국방백서에서 주적 표현이 쓰이다가, 노무현 정부 때인 2004년 국방백서부터 ‘직접적 군사위협’, ‘현존하는 북한의 군사적 위협’ 등으로 대체했다. 그 뒤 이명박 정부 첫 국방백서인 ‘2008 국방백서’엔 북은 ‘직접적이고 심각한 위협’으로 표현됐고, 천안함 사건이 발생한 2010년 국방백서에 ‘북한 정권과 북한군은 우리의 적’이란 표현이 처음 등장했다. 박근혜 정부도 이렇게 표현했다. 반면, 문재인 정부 때인 2018년과 2010년 국방백서에선 적을 북한으로 특정하지 않고, ‘주권, 국토, 국민, 재산을 위협하고 침해하는 세력을 우리의 적으로 간주한다’는 표현을 썼다. 통일부는 북한을 적으로 지목하지 않았던 노무현·문재인 정부 국방백서 사례를 들며, 이재명 정부 국방백서도 이런 맥락에서 관련 표현을 검토해야 한다는 입장이다.",https://www.hani.co.kr/arti/politics/politics_general/1264155.html
