article_id,title,published_date,section,body_text,url
1264294,"책, 사람과 세상을 잇는 통로 [.txt]",2026-06-19,문화,"책이라는 세상은 얼마나 깊고 넓은가. 책을 둘러싼 사람들은 또 얼마나 다채롭고 매력적인가. 책과 관련한 두 책, ‘책은 죽지 않는다’와 ‘선을 넘는 북클럽’을 읽고 이런 생각이 머릿속을 떠나질 않았다. 이미 책 읽기를 좋아하는 사람도, 잠시 책에서 멀어진 사람도, 아예 책을 가까이하지 않는 사람마저도, 두 책을 만난다면 당장 서점이나 도서관으로 향하고 싶어질지 모른다. ‘선을 넘는 북클럽’은 10년째 대구 동네책방 ‘하고’를 운영하고 있는 이수영 대표가 썼다. 하고 싶은 것이 너무 많아 책방 이름을 ‘하고’라고 지은 그는, 하고 싶은 독서 모임도 정말 많았다. 책을 읽어 오지 않고 그저 함께 모여 그 자리에서 읽고 이야기를 나누는 ‘잡독 모임’, 심리학 북클럽, 벽돌책 읽기 모임, 자영업 하는 언니들의 북클럽에 원데이 북클럽까지, 이 대표의 삶은 북클럽 그 자체다. 그는 북클럽이 만들어지는 과정과 그곳에서 만난 사람들의 숨결, 그리고 책방을 운영하며 얻은 삶의 지혜까지 맛깔나는 언어로 술술 풀어낸다. ‘책은 죽지 않는다’는 ‘서점은 죽지 않는다’로 한국 출판계와 서점 종사자들에게 남다른 통찰력을 제공해 주었던 이시바시 다케후미의 신작이다. 대학 졸업 후 출판사에서 영업 담당으로 일했고, 출판 전문 주간지 편집장까지 지낸 그에게 책과 서점은 ‘인생의 무늬’를 만드는 중요한 요소였다. 8살 때 1년 동안 쓴 14권의 일기를 어머니가 직접 타자로 쳐 ‘나의 일기’라는 책을 만들어 준 사연, 친구 야마모토의 서가에서 음악 비평지를 발견하고 취향의 세계에 눈뜬 고등학생 시절의 추억, 출판사 사장과 서점인에게 배운 일의 기술과 삶의 태도까지, 그의 인생 굽이굽이마다 책과 책을 사랑하는 사람들이 함께했다. 그는 서점을 “권력을 잡지 않고 세상을 바꾸는 상징”이라고 말한다. 또 “모두가 흐르는 한 방향으로 흘러가지 않고” “세상은 어차피 그런 거라며 시큰둥한 표정을 짓지 않는 사람들”이 바로 책방지기들이라고도 이야기한다. 두 저자는 서로 다른 자리에서 책과 함께 살아왔지만, 결국 같은 이야기를 들려준다. 책은 혼자 읽는 것에 그치지 않고 사람과 세상을 만나게 하는 통로라고. 그래서 책은 쉽게 사라지지 않을 것이라고.",https://www.hani.co.kr/arti/culture/book/1264294.html
1264291,자본주의·개인주의·사회계약이라는 삼중 ‘덫’ [.txt],2026-06-19,문화,"구마시로 도루의 ‘쾌적한 사회의 불쾌함’을 한마디로 정리하면 자유의 역설이라 할법하다. 더 많은 자유를 한껏 누리는 한편, 사회통념과 이데올로기의 강력한 속박에 짓눌려 사는 상황에 놓여 있다는 말이다. 지은이는 이런 당혹스러운 상황이 벌어진 것은 자본주의, 개인주의, 사회계약이라는 삼중 덫에 걸려서라고 본다. 여기서 말한 사회계약은 첫째, 밀이 말한 대로 ‘개인의 행동을 제한할 수 있는 유일하고 정당한 이유는 그 행동이 타인에게 피해를 줄 때뿐’을 뜻하고, 두번째는 루소가 말한 대로 ‘국민 모두에게 공통된 이해​에 근거한, 법의 지배를 받는 평등한 세상’을 뜻한다. 지은이가 말한 역설적 상황 가운데 우리의 실정과 유사하면서 문제의식을 공유하기에 적합한 사례는 저출생 문제다. 삼중 덫의 첫번째인 자본주의는 효율성과 생산성, 그리고 합리성의 관점에서 출산과 육아를 고민하게 한다. 두번째인 개인주의는 소비 주체로서 이 문제를 바라보게 한다. 끝으로 사회계약은 이중고를 안겨준다. 부모 처지에서는 양육하면서 아이를 학대하거나 방임해서는 안 된다. 질서의 사회적 평균치가 높아진 사회에서 품행 불량과 일탈은 아이의 장래를 어둡게 한다. 생존과 번식이 본능이건만, 시쳇말로 자산 가치와 운용 효율이라는 시장 논리로 따진다면 출산하지 않는 게 이익이 된다는 말이다. 화제를 불러일으킨 드라마 ‘참교육’으로 이 상황을 재확인할 수 있다. 폭압적인 사회질서는 학교 문화에 투영되었으니, 병영 문화가 지배했다. 부정부패는 심각했고 체벌은 일상이 되었다. 전근대의 축소판이었던 셈이다. 뜻있는 교사 집단이 교육 풍토를 바꾸기 위해 나섰다. 학생 인권을 존중하고 성적 지상주의를 철폐하자고 했다. 사회 민주화와 더불어 학교 문화도 크게 개선되었다. 이 일련의 과정을 참교육이라 했다. 그런데 오늘 우리는 어떤 결과에 이르렀는가? 교권은 무너지고 입시 교육은 더 견고해졌고 학교 폭력은 극성을 부리고 ‘일베’라는 극우를 양산했다. 힘겹게 더 많은 자유를 얻었는데, 일대 혼란이 벌어졌다. 사태가 심각해지자 드라마처럼 초법적인 행동으로 응징하는 걸 일러 ‘참교육’이라 이르게 되었다. 말뜻의 타락에 시대 상황이 농축되어 있다. 지은이는 오늘을 지배하는 습속과 통념이 초자아를 형성해 우리 자신을 감시하고 처벌한다고 지적한다. 더욱이 이 통념에 맞아떨어지게 자기계발을 하지 못한 이들의 상태를 일종의 발달장애로 보고, 의료와 복지제도에 이들의 사회화를 떠맡겼다고 주장한다. 우리식으로 말하면 능력주의만을 내세운 공정 의식이 지배하면서 사회적 약자에 대한 배려라는 정의감이 퇴화했다는 뜻이다. 흥미로운 대목은 오늘의 일본이 내세우는 바람직한 시민상이 “청결하고 경제자본과 문화자본이 풍부하며 몸집이 작은 여성”이라고 말한 것이다. 일본에 유행하는 다양한 문화 현상을 분석하여 이르는 결론은 아니지만, 일견 수긍이 간다. 책을 덮으며 “그 바깥쪽을 상상하거나 접근하는 일은 사실상 불가능해”진 이 체제의 미래를 짐작해 보았다. 삼중 덫에 갇힌 가장 근대적인 개인은 홉스가 말한 자연상태로 돌아갈 가능성이 크다. 만인에 대한 만인의 투쟁이 벌어질 터이고, 궁극에는 리바이어던의 출현을 갈망하게 될 성싶다. 제발, 이 디스토피아적 전망이 틀리기를 바랄 뿐이다. 도서평론가",https://www.hani.co.kr/arti/culture/book/1264291.html
1264289,가장 아름다운 이미지가 드러낸 가장 불편한 진실 [.txt],2026-06-19,문화,"어스름한 새벽, 검정 토끼 한마리가 전봇대 아래 “바스락 폴짝” 하고 나타난다. 한마리가 두마리가 되고, 두마리가 세마리, 네마리, 다섯마리로 불어나더니 어느새 귀를 쫑긋 세운 토끼들이 전봇대 밑에 “고물고물” 쌓인다. 깡충깡충 트럭에 몸을 실은 토끼들은 푸르른 숲속에 자리를 잡고 “오물오물” 나무를 갉아 먹기 시작한다. 숲을 가득 채울 만큼 몸집이 불어난 토끼는 마침내 터지고 만다. 그 안에서 튀어나온 오색찬란한 씨앗들이 두둥실 하늘로 흩어지고, 바다 깊은 곳으로 가라앉는다. 오세나 작가는 이처럼 더럽고 외면하고 싶은 검정 쓰레기봉투를 귀여운 토끼로, 그 안에 담긴 쓰레기를 “오백년 오색찬란하게 천년이 지나도 죽지 않는 신비로운 색”으로 표현하며 가장 아름다운 이미지를 통해 가장 불편한 진실을 드러내고 있다. 책장을 넘길수록 더욱 화려해지는 색감은 역설적으로 점점 빛을 잃어가는 지구를 떠올리게 한다. 눈부신 색채 속에 숨겨진 경고는 책을 덮은 뒤에도 오래도록 마음에 남는다. 윤이지 책읽는사회문화재단 간사",https://www.hani.co.kr/arti/culture/book/1264289.html
1264288,제국의 절정에서 파국 문턱까지…‘힘’을 좇았던 19세기 유럽사 [.txt],2026-06-19,문화,"1815년 6월, 나폴레옹 보나파르트의 프랑스 제1 제국 군대가 워털루 전투에서 대패했다. 상대는 나폴레옹의 야심을 꺾고 프랑스 대혁명(1789년)의 확산을 막으려던 유럽 동맹국들이었다. 신분제 폐지, 시민권 확대, 자유와 평등 같은 근대적 이념은 유럽 왕가와 귀족들에게 악몽이었다. 나폴레옹 몰락 이후 유럽 열강은 세력 균형과 혁명 억제를 목표로 한 복고적 국제질서인 ‘빈 체제’를 구축했다. 1848년 봄, 유럽은 들끓었다. 파리에서 왕정을 무너뜨리고 다시 공화국을 세운 2월 혁명의 불길이 빈과 베를린, 부다페스트와 밀라노로 번졌다. 일부 군주들은 퇴위를 강요받거나 망명했고, 민중은 거리로 쏟아져 나왔다. 혁명은 오래가지 못했다. 군대가 진압했고 옛 질서는 연명했다. 그러나 혁명의 여진은 거대한 지각 변동을 가져왔다. 농노제가 폐지되고, 입헌주의가 확산했다. 이탈리아(1861년)와 독일(1871년)의 통일국가 수립이 가속한 민족주의 열기와 제국주의 패권 경쟁이 갈수록 치열해졌다. 1914년 여름. 유럽 사람들은 다시 거리로 쏟아져 나왔다. 이번에는 자유가 아니라 전쟁을 환호하기 위해서였다. 베를린과 파리, 빈과 상트페테르부르크의 시민들은 국기를 흔들며 병사들을 배웅했다. 그들이 맞이한 것은 유럽 문명의 절정이 아니라 제1차 세계대전(1914~1918)이라는 재앙이었다. 19세기 초부터 20세기 초까지 유럽 100년은 과거 어느 때보다 역동적이고 급격한 변화의 시대였다. 유럽이 ‘근대’를 완성하고 ‘현대’를 개막한 전환기이자, 압도적 힘으로 세계를 장악하고 연결한 시대였다. 영국 역사학자 리처드 에번스(79, 전 케임브리지대 교수)가 그 격동의 한 세기를 서술한 ‘유럽 1815-1914: 힘을 좇아 투쟁하다’(원제는 ‘힘의 추구’, The Pursuit of Power: Europe 1815–1914)가 우리말 번역본으로 나왔다. ‘펭귄 유럽사 시리즈’의 제7권이다. 국내에는 앞서 이언 커쇼가 이 책의 이후 시기를 다룬 ‘유럽 1914-1949: 죽다 겨우 살아나다’와 ‘유럽 1950-2017: 롤러코스터를 타다’ 가 동시에 출간(2021년 1월)된 바 있다. 번역서들은 원저의 제목과 부제의 순서를 바꿔 달았다. 에번스는 1500쪽(번역서)에 이르는 대작을 관통하는 열쇳말로 국가의 모든 행위 주체들이 좇았던 ‘힘’을 꼽았다. “힘의 추구는 19세기 유럽 사회 곳곳에 스며들어 있었다. 국가는 세계 권력을 움켜잡으려 했고, 정부는 제국 권력을 얻으려 노력했으며, 군대는 군사력을 증강했고, 혁명가는 권력의 장악을 모의했다. 정당은 집권을 위해 활동했고, 은행가와 산업가는 경제권력을 확보하려 했으며, 농노와 소작인은 지주 귀족들의 자의적 권력으로부터 점차 해방됐다.” 이 시기 유럽은 두 얼굴을 지녔다. 한편에선 진보와 혁신의 기획이 성공한 시대로 기억한다. 교통·통신 수단의 비약적 발달과 경제성장이 맞물리고, 일부 지역에선 여성 선거권이 등장했을 만큼 민주주의적 가치가 약진했다. 과학기술과 의학이 전례 없는 성취를 이뤘고, 아인슈타인의 특수상대성 이론은 시공간에 대한 인간의 인식 자체를 바꿨다. 그러나 다른 한편에선, 거듭된 혁명 실패가 불러온 반동의 격랑, 살상 무기의 비약적 발달, 참혹한 노동 환경과 빈곤에 시달린 공장 노동자, 무자비한 수탈과 착취에 신음한 식민지들이 있었다. 무엇보다 “사람들은 점차 1815년 이전 수백년에 걸쳐 지배적이었던 영광이나 명예, 이와 비슷한 가치보다 힘을 우선”하게 됐다. 지은이는 특히 “19세기 말까지 ‘힘’은 유럽인들이 나머지 세계의 광대한 지역에 대한 패권을 자신들이 그 세계의 주민들보다 우월하다는 증거로 여기면서 인종적으로 재개념화됐다”고 짚었다. 지은이가 역사 서술에 ‘지구사’ 관점을 도입하고 평범한 사람들의 삶과 운명에 관심을 기울인 것도 돋보인다. 거대한 구조와 개인의 삶이 만나는 지점을 포착해 시대의 격변을 입체적으로 보여준다. 20세기 대부분의 기간 역사학자들은 국민국가의 등장과 갈등을 19세기 유럽사의 주요 특징으로 여겼다. 그러나 “유럽사를 국가 정치 및 국제관계의 역사와 동일시하는 것은 더는 불가능”하다. 지은이가 유럽사를 사건들이나 개별 국가들의 역사 집합으로 보지 않고 “초국적 접근법을 취”한 이유다. 책은 크게 8개 장으로 짜였다. 특정 시기의 통사인 만큼 연대기적 서술이 기본이지만, 지정학적 거대 서사와 개인들의 미시사를 번갈아 조명해 생동하는 현실감을 살렸다. 1장 ‘혁명의 유산’, 3장 ‘유럽의 봄’, 7장 ‘민주주의의 도전’, 8장 ‘제국의 대가’는 정치사다. 2장 ‘자유의 역설’과 4장 ‘사회혁명’은 사회경제사를 다룬다. 5장 ‘자연의 정복’과 6장 ‘감정의 시대’에선 문화사를 아울렀다. 지은이는 각 장을 주변에서 흔히 볼 수 있는 보통 사람들의 생애사로 시작한다. 8명의 개인은 모두 어떤 형태로든 기록을 남긴 실존 인물로, 출신국과 사회적 신분이 다르다. 남녀 성비는 4명씩으로 같은데, “이 균형은 매우 의도적”이다. 나폴레옹 군대에 징집돼 수없이 죽을 고비를 넘겼던 독일 석공, 농노로 태어나 자유민으로 사망한 러시아 상인, 프롤레타리아 계급의 비참을 기록한 프랑스 사회주의 활동가, 뒷날 바이마르 공화국의 작가가 된 오스트리아 귀족 여성, 헝가리의 민족주의자 시인, 핀란드 태생의 스웨덴 작가, 여성참정권 투쟁에 앞장선 잉글랜드 사회운동가, 서커스 차력사로 이집트 공연을 갔다가 고고학자가 된 이탈리아의 탐험가 등을 통해 시대를 설명한다. 19세기 유럽의 변화가 실제 사람들의 일상에 어떤 의미였는지를 보여주는 방식이다. 지은이는 “19세기 유럽이 선두로 치고 나간 것은 유럽이 본질적으로 우월했기 때문이 아니라 유럽이 처한 역사적 상황이 매우 독특했기 때문”이라며 “(유럽이 추구한) 지구적 패권이야말로 1815~1914년을 뚜렷이 구별되는 유럽사의 주요 현상”이라고 강조했다. 19세기 유럽이 ‘힘의 추구’에 힘입어 인류 역사상 가장 강력한 문명을 구축했지만, 바로 그 힘 때문에 스스로를 파괴할 조건도 함께 축적해 간 것은 역사의 아이러니이자 교훈일 테다.",https://www.hani.co.kr/arti/culture/religion/1264288.html
1264286,물·땅·사람·생태계 모두가 ‘장애’…‘상처 입은 자들의 연대’가 여는 미래 [.txt],2026-06-19,문화,"놀랍게도 미국에서 환경 운동의 대의를 수용해 첫 환경보호청을 창설(1970년)한 대통령은 공화당 소속인 리처드 닉슨이다. 닉슨은 1970년 국정연설에서 베트남에 대해선 100개의 단어도 쓰지 않았고, 환경에 대해선 1000개에 이르는 단어를 사용해 ‘파당적 대의명분’이라고 외쳤다. 백인 유권자의 호의를 얻기 위한 닉슨의 환경보호청 설립은 당시 주류 환경 운동의 폐쇄성을 보여줄 뿐 아니라, 이후 환경문제에 대한 정책적 관점을 망가뜨렸다. “백인들의 여가를 위해 원시의 황야를 보존하는 일에 수십년간 주력”한 미국의 환경 운동은 환경오염의 피해자가 정치·경제적 약자들임을 외면했고, 새로 설립된 환경보호청은 환경과 공중보건의 밀접한 상관관계를 외면했다. 그러니 문제는 제도가 아니라, 관점이다. 천문학적 재정을 쏟아부은들, 문제를 해결할 의지와 관점이 부재한다면 별 소용이 없다. 닉슨이 환경보호청을 설립하고 ‘암과의 전쟁’을 선포한 뒤에도 미국 애리조나주 투손에서는 주민들이 방산업체와 전자업체가 쏟아낸 트라이클로로에틸렌(TCE), 크롬, 카드뮴, 벤젠 등 유독성 폐기물로 오염된 물을 마시고 있었다. 나무는 괴사하고, 그 물을 마신 야생동물들은 죽어가고 아이들은 장애를 가진 채 태어났지만, 당국은 히스패닉이 주민의 다수인 점을 들어 주민들의 높은 질병 발병률을 유전적 특성으로 몰아가거나 “주민들이 먹는 칠리와 콩” 탓으로 치부했다. 야만의 시절이었다. ‘상처를 끄는 존재들’의 저자인 수나우라 테일러는 이곳 투손에서 관절굽음증이라는 선천성 장애를 갖고 태어나 유년기를 보냈다. 이 책은 그가 장애 당사자이자 연구자로서 2018년부터 3년 동안 고향인 투손 지역에 머물며 오염의 주범인 방산업체 카르텔과 현지 주민들의 투쟁을 조사·기록한 자기 민족지 방식으로 쓰였다. 저자 특유의 섬세한 글쓰기와 경계를 교차하는 사유, 촘촘한 현지·문헌 조사 덕에 한권의 책만으로 감각과 인식의 지평이 확장되는 경험을 누릴 만하다. 전작 ‘짐을 끄는 짐승들’에서 비장애중심주의의 문제를 비인간 동물들이 겪는 폭력으로 넓혔던 테일러는, 신작에서 연대의 반경을 상처 입은 물과 땅으로까지 확장하며 ‘상처 입은 자들의 환경주의’를 제안한다. “이 물에 대한 나의 감정은 두려움도, 불안도, 분노도 아니다. 그것은 연대감이다.” 자기 몸에 장애를 가져온 오염수에 대해 그는 이렇게 술회한다. 오염 물질은 그의 몸에 장애를 가져온 것처럼, 투손 사막 아래 광활한 대수층(지하수가 있는 지층)에 ‘손상’을 입혔다. 투손 지역을 오염시킨 방산업체 휴즈에어크래프트(현 레이시온)가 공장을 건설한 1951년 이래 대수층의 물 수위는 해마다 1ｍ씩 낮아졌다. 그는 대수층에 대해 연구하는 동안 이 경관에 “불구 친밀감”을 느꼈다고 고백하는데, 이는 단순한 은유나 의인화가 아니다. 인간의 안녕이 곧 땅의 안녕이고 물의 안녕이 인간의 안녕이라는 믿음, 아니 사실의 문제다. 투손의 사막과 대수층, 주민과 소 떼, 나무가 그러했듯 이제 장애는 지구 생태계 전체가 함께 겪어내는 현상이 됐다. 테일러는 이를 ‘장애의 시대’, ‘장애세’로 명명한다. 그러나 여기서 역설적으로 희망의 가능성을 찾아내는 게 이 책의 미덕이다. 그는 효율성이 지배하는 비장애중심주의 환경 운동이 발견하지 못한 공간을 장애 운동의 관점에서 열어낸다. “영원히 변해버린 우리의 생태계를 위해, 물, 공기, 대기, 공동체를 위해 장애를 가지고도 잘 살아가는 삶”을 희망하고, “지원과 상호원조가 존중받고 환호받는 시대를 열어젖힐 수 있다”는 게 그의 생각이다. 물과 땅, 사람, 생태계가 모두 ‘장애생태’로서 연결망 안에 있다는 관점은 피해자들의 연대를 가능케 한다. 유년기에 살던 집이 독성 물질의 이동 경로와 다소 떨어져 있었다는 이유로 자신이 입은 피해를 확신하지 못하는 저자에게 이 지역의 주민-활동가는 나무라며 말한다. “그런 걱정은 하지 말아요. 당신도 아마 같은 물을 마셨을 테니까!” 피해 입증 책임을 피해자에게 돌리고, 피해자들을 개별적인 신체로 분리하는 ‘오염 유발자’들의 기술에 대응할 전략은 오로지 공동체로서 연대하는 길이다. 상처 입은 자들의 연대는 희망의 동음이의어인 ‘저항’으로 이어진다. 용기 있는 세 여성 주민과 여성 기자가 방산 카르텔에 맞서 지역 사회의 피해 경험을 조직해 내는 과정은 영화처럼 극적이다. 교사 멜린다 버낼, 교육 운동가 마티 모레노, 사회복지사 캐럴 루스는 가가호호 방문 조사로 흩어져 있던 개인의 병력을 모으고, 여기서 패턴을 발견해 이 지역의 정교한 건강 설문조사 결과를 만들었다. 탐사보도 기자 제인 케이가 취재를 이어간다. 히스패닉이 다수를 차지하는 탓에 정부도 외면하던 투손 지역의 광범위한 피해와 강력한 집단 투쟁의 역사가 이렇게 급물살을 탄다. 인종·젠더·계급 차별 속에 ‘상처 입은 자들’이 거둔 승리는 기후재난 앞 인류에게 시사하는 바가 크다. 소수라도 살아남아야 한다고 주장하는 주류의 ‘구명보트 생존 전략’을 대체할 윤리를 제시하고 있어서다. 저자는 이렇게 강조한다. “장애의 시대가 개인, 공동체, 생태계에 미치는 고통스러운 위력이 더욱 거세지거나 잦아지고 있음을 고려할 때, 장애는 갈수록 강력한 기표로 부상하게 될 것이다.” 그러나 두려워할 일만은 아니다. “피해 입은 존재들, 취약한 존재들, 병들고 상처 입은 존재들, 오염물질과 독성물질의 피해를 입은 존재들을 중심에 두고 거기에서부터 새로운 세계를 건설”해 나가는 대안적 미래가 아직 선택지로 남아 있기 때문이다.",https://www.hani.co.kr/arti/culture/book/1264286.html
1264285,‘어린 백성을 어여삐 여겨’ 만든 한글? 글쎄… [.txt],2026-06-19,문화,"우리나라 사람 대부분은 학교에서 ‘나랏말싸미 듕귁에 달아’로 시작하는 ‘훈민정음 언해본’을 배운다. 선생님들은 세종이 어리석은 백성을 불쌍히 여겨 만든 최고의 문자가 한글이라고 가르친다. ‘한글, 불편한 진실’은 이렇게 우리가 알고 있는 ‘한글 신화’의 불편한 진실을 얘기한다. 저자 강명관 부산대 한문학과 명예교수는 방대한 한문학 텍스트에 바탕을 두고 풍속·사회·음악·미술 분야를 넘나들며 다채로운 저서들을 펴내고 있다. 저자는 한글이 백성을 위해 만들어진 게 아니라고 말한다. 조선 시대 백성의 절대다수는 농민이었다. 일년 열두달 노동에 시달리는 농민과 여성의 일상에 한글이 들어갈 자리는 없었다는 이유에서다. 게다가 책은 귀했고, 종이는 비쌌다. 한글 보급을 위해선 사용법을 담은 ‘훈민정음 해례본’을 많이 인쇄해 민중이 쉽게 구할 수 있을 정도로 배포해야 한다. 하지만 해례본을 대량으로 출간했다는 기록은 찾을 수 없다. 세종이 한글을 널리 보급할 생각이 없었다는 얘기다. 저자가 깨뜨리려 한 ‘한글 신화’ 가운데 가장 뜻밖인 것은 백성보다 사족(양반)이 한글을 가장 적극적으로 활용했다는 점이다. 양반의 어린 자제에게 한자를 가르칠 때 한글은 대단히 유용한 도구로 쓰였다. 한글을 가장 적극적으로 사용한 이들은 민중이 아닌 지배계급이었던 셈이다. 책은 한글 창제 원리나 과학적 우수성에 딴지를 걸지 않는다. 다만 국수주의에서 벗어나 세종과 한글을 놓고 객관적인 이해를 촉구할 따름이다.",https://www.hani.co.kr/arti/culture/book/1264285.html
